<?xml version="1.0" encoding="UTF-8"?>
<xs:schema attributeFormDefault="unqualified" elementFormDefault="qualified" xmlns:xs="http://www.w3.org/2001/XMLSchema">
  <xs:element name="keys" type="keysType"/>
  <xs:complexType name="valueType">
    <xs:simpleContent>
      <xs:extension base="xs:string">
        <xs:attribute type="xs:string" name="weight" use="required"/>
      </xs:extension>
    </xs:simpleContent>
  </xs:complexType>
  <xs:complexType name="valuesType">
    <xs:sequence>
      <xs:element type="valueType" name="value" maxOccurs="unbounded" minOccurs="0"/>
    </xs:sequence>
  </xs:complexType>
  <xs:complexType name="keyType">
    <xs:sequence>
      <xs:element type="valuesType" name="values"/>
    </xs:sequence>
    <xs:attribute type="xs:string" name="name" use="required"/>
  </xs:complexType>
  <xs:complexType name="keysType">
    <xs:sequence>
      <xs:element type="keyType" name="key" maxOccurs="unbounded" minOccurs="0"/>
    </xs:sequence>
  </xs:complexType>
</xs:schema>