<?xml version="1.0" encoding="UTF-8" standalone="no"?>
<keys xmlns:xsi="http://www.w3.org/2001/XMLSchema-instance" xsi:noNamespaceSchemaLocation="chat_bot_keys.xsd">
    
 
 
 <key name="hello">
        
  
  
  <values>
            
   
   
   <value weight="1">hi</value>
           
  
  
  </values>
       
 
 
 </key>
   
 
 
 <key name="hiiiiiiiiiiiiiiiiiiiii">
      
  
  <values>
         
   
   <value weight="3">hellllllllllllllllllllo</value>
        
  
  </values>
     
 
 </key>
  
 
 <key name="heeeeeeeee">
    
  <values>
      
   <value weight="1">helllo</value>
     
  </values>
   
 </key>
 
 <key name="sdjnijrg">
  <values>
   <value weight="1">fdfrnrtbsba</value>
  </values>
 </key>
</keys>
