<?xml version="1.0" encoding="UTF-8" standalone="no"?><keys xmlns:xsi="http://www.w3.org/2001/XMLSchema-instance" xsi:noNamespaceSchemaLocation="chat_bot_keys.xsd">

    <key name="welcome">

        <values>

            <value weight="1">hello</value>

            <value weight="1">hala wllah</value>

        <value weight="1">hala</value><value weight="5">welcome</value></values>

    </key>

    <key name="hi">

        <values>

            <value weight="3">hello</value>

            <value weight="1">yahala</value>
        <value weight="2">welcome</value><value weight="1">hala be 4bab</value></values>

    </key>
</keys>