<?xml version="1.0" encoding="UTF-8" standalone="no"?>
<keys xmlns:xsi="http://www.w3.org/2001/XMLSchema-instance" xsi:noNamespaceSchemaLocation="chat_bot_keys.xsd">
   
 
 <key name="hellllllllllllllllllllo">
      
  
  <values>
         
   
   <value weight="2">hiiiiiiiiiiiiiiiiiiiii</value>
        
  
  </values>
     
 
 </key>
  
 
 <key name="helllo">
    
  <values>
      
   <value weight="1">heeeeeeeee</value>
     
  </values>
   
 </key>
 
 <key name="dfshrgb">
  <values>
   <value weight="1">sfdhrgb</value>
  </values>
 </key>
</keys>
